Name,Price,Rating
Generic 5PCS DC 5V 6V Two Position Three Way Miniature Solenoid,"KSh 5,610",None
Generic Cylinder Fermentor Airlock Grommet Air Lock For Home Brew,"KSh 5,607",None
Generic Scary Horror Figure Rug Cutter-shaped Water Absorption,"KSh 1,213",None
Generic 20KV High Frequency High Voltage Transformer Ignition Coil,"KSh 5,609",None
Generic 50PCS SMT 2X4X3.5MM Tactile Tact Push Button Micro Switch,"KSh 5,608",None
Generic Children Camera Photo Video Game Photo Filter Frame,"KSh 12,561",None
Generic In Stock Transformation KO MP44 12cm Model Op Prime Transforming Toy Autobots,"KSh 25,590",None
Fashion Teardrop-shaped Pendant Electroplated Memorial Pendant,KSh 578,None
Generic Funny Pet Snuffle Ball Toy Interactive Dog Puzzle Toy,"KSh 1,915",None
Generic D50 Portable Mini Waterproof Bluetooth Speaker(Blue),"KSh 2,799",None
Generic PMS5003 PMS7003 PMSA003A Sensor Module PM2.5 Air Particle,"KSh 5,605",None
Generic 42.6mm Two-Layer Golfs Practice Ball Portable Lightweight,KSh 289,None
Generic 72/90mm Swing Practice Golfs Balls Wear Resistant Durable,KSh 214,None
Fashion Teardrop-shaped Pendant Electroplated Memorial Pendant,KSh 597,None
Generic Pet Cat Silicone Snuffle Mat Flower Lickinng Pad Non-slip,"KSh 1,265",None
Generic 28 Ring Scarf Shawl Hangers For Clothes Holder Foldable Tie,"KSh 5,601",None
Generic 45 Pcsbag Cute Deco Stickers Bullet Journaling Accessories,"KSh 5,610",None
Generic Ultrasonic Levitation Kit DIY Ultrasonic Sensor Acoustic,"KSh 5,601",None
Generic 1S 12A 16A 24A 3.7V 18650 Li-ion 3.2V LifePo4 Lithium,"KSh 5,609",None
Generic 25mm Diameter Golfs Cap Clip Convenient Use Ball Posistion,KSh 214,None
Generic IMD TPU Phone Case For IPhone 12 Pro Max,KSh 899,None
Fashion  Nylon Backpack Lightweight Handbag Satchel With,"KSh 2,721",None
Generic Pet Heating Pad Cat Dog Self-Heating Blanket 9 Levels,"KSh 4,163",None
Generic Elastic Tinsel Bracelet Sparkling Tinsel Wristbands Vibrant for Kids Red  Golden,KSh 205,None
915 Generation Foldable Fabric Storage Box Set Cotton Linen Storage Basket,"KSh 2,693",None
Generic OUTDOOR  Quick Opening Folding Knives 5CR18MOV Blade,"KSh 5,600",None
Generic RF-500TB 32mm With Belt Pulley DC Motor 3V-12V 11250RPM,"KSh 5,610",None
Generic 4pcs Anti-Static Wide Teeth Comb Detangling Hair Brush Tail,KSh 553,None
Generic Sonoff RF WiFi Wireless Switch 433MHz Receiver Remote,"KSh 5,606",None
Generic 50Pcs Burlap Lace Cutlery Pouch Holder Bag Hessian Rustic,"KSh 3,645",None
Generic Baby Musical Piano Dance Kids Playing Game Mat Instruments,"KSh 5,603",None
Generic Cute Soft Plush Keyrings With Mini Sunglasses Lightweight,KSh 286,None
Generic Knitted Gloves Cozy Floral Touch Screen Knit Gloves Warm for Women Camel,KSh 891,None
Fashion Metal Frame Presbyopic Glasses Full Frame Clear Reading,KSh 299,None
Fashion  Leather Cross-body Bag Simple Zipper Shoulder Bag,"KSh 3,491",None
Fashion Blue light blocking men and women anti-fatigue headache computer glasses,KSh 806,None
Fashion Blue light blocking men and women anti-fatigue headache computer glasses,"KSh 1,034",None
Generic Double E Car Toys For Boys E Control Truck 1/16 Radio-Controlled Dumper,"KSh 10,890",None
Generic Pet Grooming Needle Comb Multifunctional Pet Massage Comb,"KSh 1,216",None
Generic 240PCS 6X30mm Blow Ceramic Fuse 24Values 250V 0.1A 0.2A 0.5A 1A 1.5A,"KSh 3,046",None
